<?xml version="1.0" encoding="UTF-8"?>
<!DOCTYPE component SYSTEM "http://www.freac.org/boca/component.dtd">
<component>
  <name>WebM Audio Extractor</name>
  <version>1.0</version>
  <id>avconv-webm_audio-in</id>
  <type>decoder</type>
  <format>
    <name>WebM Video</name>
    <extension>webm</extension>
  </format>
  <external>
    <command>avconv</command>
    <arguments>-i %INFILE -vn %OPTIONS -f wav -</arguments>
    <mode>stdio</mode>
    <outformat>wave</outformat>
  </external>
</component>
