<?xml version="1.0" encoding="UTF-8"?>
<!DOCTYPE component SYSTEM "http://www.freac.org/boca/component.dtd">
<component>
  <name>WavPack Audio Decoder</name>
  <version>1.0</version>
  <id>wv-dec</id>
  <type>decoder</type>
  <replace>ffmpeg-wv-dec</replace>
  <format>
    <name>WavPack Files</name>
    <extension>wv</extension>
    <companion>wvc</companion>
    <tag id="apev2-tag" mode="append">APEv2</tag>
  </format>
  <external>
    <command ignoreExitCode="true">wvunpack</command>
    <arguments>%OPTIONS %INFILE -o -</arguments>
    <mode>stdio</mode>
    <outformat>wave</outformat>
    <md5 require="lossless" prefix="original md5:">-s %INFILE</md5>
    <parameters>
      <range name="Number of threads to use" argument="--threads=%VALUE" enabled="true" default="1" hidden="true">
	<requires option="--threads[=n]" arguments="--help"/>
	<min>1</min>
	<max>12</max>
      </range>
    </parameters>
  </external>
</component>
