<?xml version="1.0" encoding="UTF-8"?>
<!DOCTYPE component SYSTEM "http://www.freac.org/boca/component.dtd">
<component>
  <name>MPEG Video Audio Extractor</name>
  <version>1.0</version>
  <id>avconv-mpg_audio-in</id>
  <type>decoder</type>
  <format>
    <name>MPEG Video Files</name>
    <extension>mpg</extension>
    <extension>mpeg</extension>
  </format>
  <external>
    <command>avconv</command>
    <arguments>-i %INFILE -vn %OPTIONS -f wav -</arguments>
    <mode>stdio</mode>
    <outformat>wave</outformat>
  </external>
  <external>
    <command>ffmpeg</command>
    <arguments>-i %INFILE -vn %OPTIONS -f wav -</arguments>
    <mode>stdio</mode>
    <outformat>wave</outformat>
  </external>
</component>
