<?xml version="1.0" encoding="UTF-8"?>
<!DOCTYPE component SYSTEM "http://www.freac.org/boca/component.dtd">
<component>
  <name>MP4 Video Audio Extractor</name>
  <version>1.0</version>
  <id>avconv-m4v_audio-in</id>
  <type>decoder</type>
  <format>
    <name>MP4 Video Files</name>
    <extension>m4v</extension>
    <tag id="mp4-tag" mode="other">MP4 Metadata</tag>
  </format>
  <external>
    <command>avconv</command>
    <arguments>-i %INFILE -vn %OPTIONS -f wav -</arguments>
    <mode>stdio</mode>
    <outformat>wave</outformat>
  </external>
  <external>
    <command>ffmpeg</command>
    <arguments>-i %INFILE -vn %OPTIONS -f wav -</arguments>
    <mode>stdio</mode>
    <outformat>wave</outformat>
  </external>
</component>
