<?xml version="1.0" encoding="UTF-8"?>
<!DOCTYPE component SYSTEM "http://www.freac.org/boca/component.dtd">
<component>
  <name>QuickTime AAC Encoder</name>
  <version>1.0</version>
  <id>qaac-enc</id>
  <type>encoder</type>
  <format>
    <name>MP4 Audio Files</name>
    <extension>m4a</extension>
    <tag id="mp4-tag" mode="other">MP4 Metadata</tag>
  </format>
  <external>
    <command>qaac</command>
    <arguments>--ignorelength %OPTIONS -o %OUTFILE -</arguments>
    <mode>stdio</mode>
    <informat>wave</informat>
    <parameters>
      <range name="True VBR Mode" argument="--tvbr %VALUE" default="60" step="1" enabled="true">
	<min alias="worse">0</min>
	<max alias="better">127</max>
      </range>
      <range name="Constrained VBR Mode" argument="--cvbr %VALUE" default="128" step="8">
	<min alias="8 kbps">8</min>
	<max alias="320 kbps">320</max>
      </range>
      <range name="ABR Mode" argument="--abr %VALUE" default="128" step="8">
	<min alias="8 kbps">8</min>
	<max alias="320 kbps">320</max>
      </range>
      <range name="CBR Mode" argument="--cbr %VALUE" default="128" step="8">
	<min alias="8 kbps">8</min>
	<max alias="320 kbps">320</max>
      </range>
      <selection name="Quality" argument="--quality %VALUE" default="2" enabled="true">
	<option alias="High">2</option>
	<option alias="Normal">1</option>
	<option alias="Fast">0</option>
      </selection>
      <selection name="Samplerate" argument="--rate %VALUE" default="auto" enabled="true">
	<option alias="Auto">auto</option>
	<option alias="Keep">keep</option>
	<option alias="8.000 Hz">8000</option>
	<option alias="11.025 Hz">11025</option>
	<option alias="12.000 Hz">12000</option>
	<option alias="16.000 Hz">16000</option>
	<option alias="22.050 Hz">22050</option>
	<option alias="24.000 Hz">24000</option>
	<option alias="32.000 Hz">32000</option>
	<option alias="44.100 Hz">44100</option>
	<option alias="48.000 Hz">48000</option>
      </selection>
      <switch name="Enable HE-AAC Mode" argument="--he"/>
    </parameters>
  </external>
  <external>
    <command>qaac64</command>
    <arguments>--ignorelength %OPTIONS -o %OUTFILE -</arguments>
    <mode>stdio</mode>
    <informat>wave</informat>
    <parameters>
      <range name="True VBR Mode" argument="--tvbr %VALUE" default="60" step="1" enabled="true">
	<min alias="worse">0</min>
	<max alias="better">127</max>
      </range>
      <range name="Constrained VBR Mode" argument="--cvbr %VALUE" default="128" step="8">
	<min alias="8 kbps">8</min>
	<max alias="320 kbps">320</max>
      </range>
      <range name="ABR Mode" argument="--abr %VALUE" default="128" step="8">
	<min alias="8 kbps">8</min>
	<max alias="320 kbps">320</max>
      </range>
      <range name="CBR Mode" argument="--cbr %VALUE" default="128" step="8">
	<min alias="8 kbps">8</min>
	<max alias="320 kbps">320</max>
      </range>
      <selection name="Quality" argument="--quality %VALUE" default="2" enabled="true">
	<option alias="High">2</option>
	<option alias="Normal">1</option>
	<option alias="Fast">0</option>
      </selection>
      <selection name="Samplerate" argument="--rate %VALUE" default="auto" enabled="true">
	<option alias="Auto">auto</option>
	<option alias="Keep">keep</option>
	<option alias="8.000 Hz">8000</option>
	<option alias="11.025 Hz">11025</option>
	<option alias="12.000 Hz">12000</option>
	<option alias="16.000 Hz">16000</option>
	<option alias="22.050 Hz">22050</option>
	<option alias="24.000 Hz">24000</option>
	<option alias="32.000 Hz">32000</option>
	<option alias="44.100 Hz">44100</option>
	<option alias="48.000 Hz">48000</option>
      </selection>
      <switch name="Enable HE-AAC Mode" argument="--he"/>
    </parameters>
  </external>
</component>
