<?xml version="1.0" encoding="UTF-8"?>
<!DOCTYPE component SYSTEM "http://www.freac.org/boca/component.dtd">
<component>
  <name>Apple Lossless Decoder</name>
  <version>1.0</version>
  <id>avconv-alac-dec</id>
  <type>decoder</type>
  <replace>alac-dec</replace>
  <format>
    <name>Apple Lossless Files</name>
    <extension>m4a</extension>
    <tag id="mp4-tag" mode="other">MP4 Metadata</tag>
  </format>
  <external>
    <command>avconv</command>
    <arguments>-i %INFILE %OPTIONS -f wav -</arguments>
    <mode>stdio</mode>
    <outformat>wave</outformat>
  </external>
  <external>
    <command>ffmpeg</command>
    <arguments>-i %INFILE %OPTIONS -f wav -</arguments>
    <mode>stdio</mode>
    <outformat>wave</outformat>
  </external>
</component>
